{"action":"accept","authorization_id":"dm:review-authorization:v1:hqWObneqAO_glN53RSzQ8YjIK60krZCiGTkgQoN40Xk","decided_at_ms":1800000000001,"decision_id":"dm:review-decision:v1:Kniv6eMsmD-O2oAcEkfea7NsqfJPN6t52H_Z0ND4Nyg","decision_nonce":"33000000-0000-4000-8000-000000000011","note_ref":"note:dm033-vector","predecessor_decision_id":"dm:review-decision:v1:m1L_DjuEh26HeqUtjLQP197FrdJQl6yS9fg-pOcqO6o","reason":"evidence-sufficient","replacement":null,"review_request_hash":"189ffee2699420b7fec1f259bcfad8c22134ed9c754993a8fb1002f4f75514ec","review_request_id":"dm:review-request:v1:be1j1nbUm1-oJZz9yDyBE61JfLTapCkXHpe2tjLn98s","reviewer_key_id":"dm:key:v1:w771A2Yd3zSFDOkMR87y2tsTm2gvQrqGMdpzNpphags","schema":"dm.review.human-decision/v1","signature":{"alg":"Ed25519","kid":"dm:key:v1:w771A2Yd3zSFDOkMR87y2tsTm2gvQrqGMdpzNpphags","value":"ma-3xvKc8rO8asQonDz78-R1crj0ppgOYykkbQvclbAefqs0RiBsQE3RFl9yQb2TBxfv4Gb2wSi4xhGhexRyBg"}}
