{"action":"defer","authorization_id":"dm:review-authorization:v1:hqWObneqAO_glN53RSzQ8YjIK60krZCiGTkgQoN40Xk","decided_at_ms":1800000000000,"decision_id":"dm:review-decision:v1:m1L_DjuEh26HeqUtjLQP197FrdJQl6yS9fg-pOcqO6o","decision_nonce":"33000000-0000-4000-8000-000000000010","note_ref":"note:dm033-vector","predecessor_decision_id":null,"reason":"reconsideration-needed","replacement":null,"review_request_hash":"189ffee2699420b7fec1f259bcfad8c22134ed9c754993a8fb1002f4f75514ec","review_request_id":"dm:review-request:v1:be1j1nbUm1-oJZz9yDyBE61JfLTapCkXHpe2tjLn98s","reviewer_key_id":"dm:key:v1:w771A2Yd3zSFDOkMR87y2tsTm2gvQrqGMdpzNpphags","schema":"dm.review.human-decision/v1","signature":{"alg":"Ed25519","kid":"dm:key:v1:w771A2Yd3zSFDOkMR87y2tsTm2gvQrqGMdpzNpphags","value":"t_ZExRPA1IfI0xJ7wl0Yzm9-cxIAUIwhNNXhyQdaNbhVia6ouCMRJm2PZnp6vS46E6NYAntzvX842jxEZFFQAw"}}
