{"action":"accept","authorization_id":"dm:review-authorization:v1:zcAiM79qXNPK1rtfJrqYdFI-jzpkLc_nETBaisxnObY","decided_at_ms":1800000000000,"decision_id":"dm:review-decision:v1:kQ0ncGKD2lfyVeyzJviNoYWUOkbumZX9OFV0OU3DsLo","decision_nonce":"33000000-0000-4000-8000-000000000020","note_ref":null,"predecessor_decision_id":null,"reason":"evidence-sufficient","replacement":null,"review_request_hash":"e73135a47b01fe8e4ea7cebf4eeedaa08c7e8b85001d962cc96947085fc39fc8","review_request_id":"dm:review-request:v1:c0WDHbzuYNzHeR_J-Lb7ypqJXAKpVGBKyyMpvwkHgiY","reviewer_key_id":"dm:key:v1:Pnx8ZPwgbGlMv3wKvpO22b4MA0ufLAOSkzzueJh0Vj8","schema":"dm.review.human-decision/v1","signature":{"alg":"Ed25519","kid":"dm:key:v1:Pnx8ZPwgbGlMv3wKvpO22b4MA0ufLAOSkzzueJh0Vj8","value":"ulDRAXEqtqKNr7ubamB0oLw_FZ_lizO_tv-G1_wjV1agZ5H_BsYv4zKmVdVRxt5pAPjQNqIquxps8ZZfk6e9Ag"}}
