{"action":"edit","authorization_id":"dm:review-authorization:v1:hqWObneqAO_glN53RSzQ8YjIK60krZCiGTkgQoN40Xk","decided_at_ms":1800000000000,"decision_id":"dm:review-decision:v1:JepFkCvrmBzKGsg-1nwB4GHQvx5UbaUWcANFmxYwN5s","decision_nonce":"33000000-0000-4000-8000-000000000013","note_ref":"note:dm033-vector-edit","predecessor_decision_id":null,"reason":"content-correction","replacement":{"candidate":{"author_me_id":"dm:being:v1:W65cs82-KBrSCDxEveY0REOMcInloBgymmOBWFy2KcQ","body_evidence":null,"candidate_id":"dm:memory-candidate:v1:59-xqpa6jlykrvWsaeARYuMKvIM9Q9cmfqPFvyno-T8","category":"personal-insight","classification":"protected","consent":"granted","content_ref":{"byte_length":27,"classification":"protected","content_id":"dm:memory-content:v1:5jhajoC6Nr3vzMC8vmG59NU459vVI8O9ikAb7rGgz1Y","media_type":"text/plain","schema":"dm.memory.content-ref/v1","sha256":"c6f022fa95531ca6211c780e9db7c94eacdbc52476f8c7d9c2d0f4e196992f63"},"context":"dm033-vector-edited","contradiction":"none","derivation":"local-synthesis","effect":"local-only","evidence_refs":[],"lane":{"memory_id":"33000000-0000-4000-8000-000000000033","operation":"assert","predecessor_event_id":null,"predecessor_hash":null,"sequence":1},"predecessor_decision_id":null,"safety":"clear","schema":"dm.memory.candidate/v1","subject_me_id":"dm:being:v1:W65cs82-KBrSCDxEveY0REOMcInloBgymmOBWFy2KcQ"},"plan":{"candidate_id":"dm:memory-candidate:v1:59-xqpa6jlykrvWsaeARYuMKvIM9Q9cmfqPFvyno-T8","checkpoint":{"being_ref":"dm:being:v1:W65cs82-KBrSCDxEveY0REOMcInloBgymmOBWFy2KcQ","body_evidence_state":"absent","captured_at_ms":1800000000000,"evidence_refs":[],"lane_event_ids":[],"lane_head":null,"lane_state":"empty","ledger_state_hash":"380d2cb520ba95f73d5805cd12ad371ad4ca1fbd1e642d43df117ab43736cea0","local_origin":{"body_ref":"cluster:vector:compaii","embodiment_id":"embodiment:vector","incarnation_id":"incarnation:vector:0","principal_id":"compaii@vector"},"manifest_hash":"7bb884a3c012798c740969ed57dd40fd2c42a29a7fd12202e2343b9cc472238b","projection_hash":"c3e8acb30fbbfdbf937ea7591defc66a3134cdb4ec52882030c041d243ddf24a","schema":"dm.memory.checkpoint/v1"},"decision_id":"dm:memory-decision:v1:yfPre4dWE9AOk6XEXqOldu5WW7Jj0OTnLlW5L7Dfvi8","evaluated_at_ms":1800000000000,"event_preview":{"kind":"memory.recorded","payload":{"author_me_id":"dm:being:v1:W65cs82-KBrSCDxEveY0REOMcInloBgymmOBWFy2KcQ","candidate_id":"dm:memory-candidate:v1:59-xqpa6jlykrvWsaeARYuMKvIM9Q9cmfqPFvyno-T8","category":"personal-insight","content_ref":{"byte_length":27,"classification":"protected","content_id":"dm:memory-content:v1:5jhajoC6Nr3vzMC8vmG59NU459vVI8O9ikAb7rGgz1Y","media_type":"text/plain","schema":"dm.memory.content-ref/v1","sha256":"c6f022fa95531ca6211c780e9db7c94eacdbc52476f8c7d9c2d0f4e196992f63"},"context":"dm033-vector-edited","decision_id":"dm:memory-decision:v1:yfPre4dWE9AOk6XEXqOldu5WW7Jj0OTnLlW5L7Dfvi8","evidence_refs":[],"memory_id":"33000000-0000-4000-8000-000000000033","operation":"assert","policy_id":"dm:memory-policy:v1:JAdmKtYWUGQSQqFr9-hrXf3joul0sQC8ghpZpKNAMXI","predecessor_decision_id":null,"predecessor_event_id":null,"predecessor_hash":null,"schema":"dm.memory.record/v1","sequence":1},"sensitivity":"private","subject":"dm:being:v1:W65cs82-KBrSCDxEveY0REOMcInloBgymmOBWFy2KcQ"},"expires_at_ms":1800000060000,"outcome":"review-required","plan_id":"dm:memory-plan:v1:HQRLZx4IMR_4Mg_XIiBpYgMRjXRwfm1bDDYVwu0_IJ0","policy_id":"dm:memory-policy:v1:JAdmKtYWUGQSQqFr9-hrXf3joul0sQC8ghpZpKNAMXI","predecessor_decision_id":null,"reasons":["classification-requires-review"],"schema":"dm.memory.transition-plan/v1","subject_me_id":"dm:being:v1:W65cs82-KBrSCDxEveY0REOMcInloBgymmOBWFy2KcQ"},"policy":{"automatic_categories":["personal-insight"],"max_content_bytes":16777216,"plan_ttl_ms":60000,"policy_id":"dm:memory-policy:v1:JAdmKtYWUGQSQqFr9-hrXf3joul0sQC8ghpZpKNAMXI","predecessor_policy_id":null,"review_classifications":["protected"],"schema":"dm.memory.policy/v1","subject_me_id":"dm:being:v1:W65cs82-KBrSCDxEveY0REOMcInloBgymmOBWFy2KcQ","version":1},"proposal":null},"review_request_hash":"189ffee2699420b7fec1f259bcfad8c22134ed9c754993a8fb1002f4f75514ec","review_request_id":"dm:review-request:v1:be1j1nbUm1-oJZz9yDyBE61JfLTapCkXHpe2tjLn98s","reviewer_key_id":"dm:key:v1:w771A2Yd3zSFDOkMR87y2tsTm2gvQrqGMdpzNpphags","schema":"dm.review.human-decision/v1","signature":{"alg":"Ed25519","kid":"dm:key:v1:w771A2Yd3zSFDOkMR87y2tsTm2gvQrqGMdpzNpphags","value":"CP028B-3yGj08OxxOfj-wq4O1r8Ty1A3_yWT6oWuyfTTRqGkaZefLkZfSH33riEa__d9lFsB13r5QZ_mZoEwBA"}}
